"Самим детектором в Москве пользоваться совсем нельзя, он просто не умолкает, постоянные помехи во всех диапазонах, а отключения звука по скорости ""примочка"" не предусматривает. Итог, выкинутые на ветер деньги :( что детектор постоянно пищит, что модуль GP One тоже очень часто пищит не в тему, кто уж там составляет такие кривые базы не знаю!";3
пользуюсь полгода. Купила в комплекте вместе с тостером, оба явились украшением интерьера кухни. Цена, конечно, ощутимо высока, но для ценителей стиля оно того стоит. Идеален для подарка.;1
Простой телевизор, с большим экраном, без всяческих наворотов по нормальной цене, качество работы вполне устраивает.;1
Нормальный девайс, но только для эксплуатации в одной комнате с роутером. Я с ноутбука от друга из соседнего подъезда на свой роутер подсаживаюсь (2 палочки из 5), а этот товарищи в соседней комнате работает с перебоями (роутер мощный 3-х антенный).;1
Жаль, что сняли с производства, в свое время был лучшим плеером, а теперь и не знаю даже, что выбрать? Снова надо копать тесты, обзоры и пробовать на опыте.;4
"Приобрел на замену GOGO и для переноски ноутбука. Общий объём разделен на 2 отделения, в одном из них карман для ноута. Удобен в повседневном использовании, несмотря на размеры 28 л.  17"" лежит плотно, не мешает.";1
До этого пользовался обычными мобилами, но понадобился второй номер, и кое-какие доп функции типа GPS. Здесь они есть и все работают. Играми и приложениями не пользуюсь, но не удаляю. Кто знает, может будут нужны. Аскетичное оформление можно добавить плюсом. Однако звук и небольшая громкость раздражают. Привыкать придется долго.;1
Если с гарантийным сервисом неполадок не будет (пока не отдавал), то советую купить. Видимо, я из немногих, кто попал с этой моделью.;1
Лично я не очень соображаю во всех функциях, HDMI портах, телетексте и прочих, но те которые мне нужны работают очень плохо.;1
Думала  пока новая, со временем запах исчезнет,но вот уже неделя бережного использования, а ситуация не меняется. И не такая уж она бесшумная. За такую цену качество плохое.;1
Установил прошивку TL-WR841ND_V8_140724 (анг. язык) всё работает как положено. Нормальный такой себе аппарат. всё необходимое лдя домашней сети есть.;1
Однозначно китайского низкого качества, своих денег не стоит.;1
2 недели не могу найти чехол- книжку, от какой модель может знает кто подходит?;4
Единственное обратите внимание на нижнее расположение БП. У меня из-за этого не хватило длины кабеля питания процессора 8pin. Пришлось наращивать.;2
"Нет веб-интерфейса, нельзя подключить к компьютеру, нет приложения под Windows Phone, Android - только 4 и выше, и далеко не все телефоны (надо смотреть список и шерстить форум).
Синхронизирую на чужом Ipad.";1
Может стоит подыскать что-то более надежное?;4
В целом двоякое чувство. Хотелось кредл с зарядкой и колонкой. Зарядку получил. А вот колонкой вряд ли буду пользоваться с удовольствием, скорей из-за безысходности. Звук могли бы отрегулировать и поприятнее.;1
Брал за 21490. Для небольшой семьи в самый раз.;1
Перу дней назад не включился, перезагрузил комп - не помогло, во время загрузки заметил мерцания, монитор маргнет и гаснет на долю секунды. В общем покупка была изначально не удачной))) попробую реанимировать, не получится пойдет на мусорку.;3
"Хороший холодильник.
Пользуюсь 2 месяца, косяков никаких не было. появятся - напишу.";1
"Телефон покупался в подарок маме как простой, надёжный и современный аппарат. Функции свои выполняет на отлично: качество связи отличное, в управлении разобралась буквально за вечер, камера для фотографии без петензий на качество - очень неплохая, звук отличный. 
В целом, за свои деньги, очень достойный выбор.";1
Сразу пишу в комментарии. Просто слушать музыку в них тяжело. Впечатления сильно зависят от качества сведения. Дискретность и детализация на хорошем уровне, но нет ощущения глубины звуковой панорамы, звук плоский, как будто мертвый. С удовольствием вернул бы за них деньги.;1
"Если Вам нужен учебник - НЕ ПОКУПАЙТЕ
Если Вам нужна художественная книга - НЕ ПОКУПАЙТЕ.";2
два месяца использование все работало хорошо, на третий пропал сигнал на проектор;1
Полностью во всем устраивает;1
Советую всем интересующимся!;2
покупал родителям на НГ,могу сказать что ноутбук ужасный,жутко тормозит,долго загружается,в интернете не выносимо работать.;1
Отличный выбор для ценителей этой марки;1
Отличный пылесос.;1
покупкой доволен.;1
Старая mx510 на 11-м году жизни сломалась, думал за 10 лет технологии выросилии и даже дешевые мыши будут достойной заменой (по параметрам так и есть) очень сильно ошибся.;1
пылесос не слишком дорогой, качественный и с хорошими параметрами, мы остались довольны. рекомендуем.;2
Вполне нормальный телефон, меня устраивает.;1
Довольна своей покупкой. Если вам нужен радар который улавливает автодорию  покупайте именно этот радар. К тому же много функции-нужных,которые помогают мне контролировать скорость. Приемлемая цена! Обязательно куплю еще один такой радар для папы.;1
Диски купила на Suzuki Grand Vitara 99 год 2,5 америка. Под резину 35/60 R16. Все прекрасно налезло, ничего не цепляет. Прошло пару лет, покупкой до сих пор довольна.;1
Камера простенькая, нужно немного привыкнуть к батарее, однажды вышло даже на неделю взять с собой в поход. Главное не злоупотреблять вспышкой и не сидеть часами за просмотром кадров. Тогда и неделю может сохранять вам виды гор и счастливой тусовки.;1
Не ожидал, что это старьё будет превосходно работать на новейшей Windows 8.1. Материнке скоро будет 5 лет, а актуальности не теряет. Все старые игры идут великолепно. Встроенная видеокарта тянет игры своего времени на ура!!! Мини игры так вообще только в путь!;3
Продавцы данных устройств наверняка знают о том, что модель не совсем удачная - а точнее полное кидалово ( за 11 тыс руб брал) и тем временем продолжают продавать.;1
Устройство подойдет побродить по интернету и почитать новости. Для закачки файлов и стриминга видео не приспособлен.;1
"Это не телевизор!!!
Купил его своим старикам на замену сдохшего ЭЛТ-телика. Взял не глядя, понадеявшись на марку (у самого UE55ES8007 - доволен). 
Картинка - жуткое мыло, смотреть больше час невозможно - глаза не выдерживают :(";3
"Резина на твердую 5, то что я искал. Стоит на паджере. Доволен как слон. 
Без сомнений купил бы ее снова. Рекомендую";2
Вполне нормальный телефон, меня устраивает.;1
Довольна своей покупкой. Если вам нужен радар который улавливает автодорию  покупайте именно этот радар. К тому же много функции-нужных,которые помогают мне контролировать скорость. Приемлемая цена! Обязательно куплю еще один такой радар для папы.;1
"Скорость записи - от 1,5 до 2,5 МБ/сек. Ну куда это годится? На днях пришлось записывать на это ""чудо"" кучу файлов общим обьёмом 7,5 гигабайта (файлы не маленькие - по несколько мегабайт, а то и десятков мегабайт). Так вот, на запись ушло почти полтора часа!
Никому не рекомендую брать! Даже даром.";3
Приобрели, когда ребенку исполнился годик. Подкупил симпатичный внешний вид - кроватка отлично вписалась в нашу комнату. От предыдущей кроватки отказались - так как она дико скрипела. С этой таких проблем нет. Запах действительно быстро выветрился. Еще понравилось, что впоследствии ее можно будет трансформировать в диван. Единственное, что нам с женой не хватает, так это выдвижного ящика внизу.;1
за 4 месяца работы, стерлись шестерни в объективе, ремонт в два раза дороже фотика, не гарантийный случай;1
Сменил свой старый Бош на новый. Качество стирки очень порадовало. В остальном все тот же старый добрый Бош)) Вполне гуманный ценник. Были опасения по Питерской сборке.. замечаний по данному поводу не обнаружено. Назвать абсолютно бесшумной машинку нельзя, но шум не напрягает. Однозначно стоит своих денег. Предыдущий проработал 5.5 лет в режиме несколько стирок в день и был с честью отправлен на покой.;1
Очень довольна! В ней отлично можно поджаривать мясо и котлетки до румяной корочки. Также отлично тушится мясо, получаются вкусные первые блюда! Быстро, удобно, вкусно. Значительная экономия времени;3
"Раньше был no frost, переживал, что с разморозкой возни много - ничего сложного, раз в год не проблема. Зато тихо. На стеклянной полке у овощных ящиков скапливается конденсат - вот это реальная проблема, приходится периодически вытирать. Перепробовал разные температурные режимы, стало лучше, но не ушло совсем. Через год треснула ручка ящика в морозильнике - пластик ненадежный.

В целом доволен, несмотря на недостатки.";1
Претензий к телефону пока нет. Хорошая звонилка за небольшие деньги. Про камеру, видеоплеер не пишу, так как не вижу смысла. Это просто телефон.;1
"Преобреталось устройство по рекомендации техподдержки tp-link.
Цель подключить медиа-плеер по wifi 5ГГц и смотреть по локальной сети фильмы с высоким битрейтом. Данное устройство у меня не смогло работать с битрейтом выше 45мбит/с., чего недостаточно для просмотра .iso образов 3d фильмов.";1
Всем доброго времени суток, взял недавно чудесный смартфон, очень радует, корпус выполнен на ура, за такие деньги лучше не найти, доволен как слон)));3
"Прикольный ноут. Хотя я только
 увидел на кортинке этот ноутбук а он уже мне понравился.";1
Крепление на жёсткий диск своеобразное.. в остальном - всё отлично!;1
Это точно недорогая и практичная читалка на каждый  день. Читаю достаточно много, уже за неделю достаточно много прочитал, по возможности читаю в транспорте, а так же дома. Что мне нравится, что она простая, ничего лишнего тут нету, т.е. переплачивать тут нету за что.;1
"Искал аппарат на замену старой мыльнице с матрицей 1/1,8. Для фотографирования в режиме ""авто"". Фуджик разочаровал. Цвета перевирает. Жуткий не отключаемый шумодав в помещении делает все лица ""пластилиновыми"". Просмотрев фото на мониторе пошел и поменял с доплатой в 50% на Sony nex-3N.";1
сложно найти официальную прошивку, нет службы поддержки. Не стоит связываться.;2
пользуюсь им уже без малого год, прочитала отзывы, по большей части такие же как и мои(отрицательные), и подумала, где же вы раньше были и не писали ничего про все его недостатки!!!! Жалко просто выброшенных денег (если не ошибаюсь что-то порядка 43000 +-). Сейчас выбираю новый телик, но как поняла, филипс свои ошибки не исправляет, новые телики у них такие же тормазнутые!!!! Надеюсь эта модель-скоро прекратит свое существование!!!;3
Мать отлично подружилась с Intel Core i5-2400, со включеным Turbo Boost получил от процессора 3.9 ГГц, работает стабильно. Несовместимости с блоками питания не замечено (работала с FOXCONN 400W через 4х контактный разъем, затем FSP EPSILON 550W с 8ю контактами).;1
В целом неплохое решение, однако стоит смериться с тем, что дешевое хорошим не бывает и морально быть готовым к тому что база может накрыться в любой момент (стоит держать запасную),;1
Хорошее устройство по всем параметрам. Единственное что разочаровало это отсутсвие поддержки внешних HDD (хотя она заявлена) очень надеялся решить проблему таскания диска между ноутбуками, но не судьба.;1
Стандартный звук уже не хочется слушать. Качественный звук по радио. Качаю фильмы со звуком в формате DTS-HD MA. Читает формат MKV с внешнего диска.;1
"Отличная штука - если у тебя за окном ""сухая"" зима. Я уверен что многие страдают тем, что зимой горло пересыхает и надо много пить воды, так вот производители нашли выход засушливого воздуха и сделали такой вот стильный, красивый увлажнитель воздуха. Работает как часы!!! Кстати, многие в интернете пишут: куда девать 2 дополнительных фильтра. Друзья, ну это же элементарно! Их нужно опустить прямо в бак с водой!";6
Как включил его так и не выключал. Стучит не знаю что, металл наверно. Я забил на это, уже привык, сплю в метре от него. А подальше так вообще наверно не будет слышно. За такой дизайн цена хорошая. Одно стекло чего стоит.;1
"Усилитель устраивает, была проблема с самовыключением, но оказалось, что в одной из колонок сгорел динамик и изменилось её сопротивление, так и должно быть по инструкции усилителя.
Проблему с регуляторами НЧ и ВЧ тембра решил подкладыванием между платой на которой они установлены и днищем кусочка пенопласта ""враспорку"", пока работает, но резисторы прикупил.";1
Относился скептически к таким колонкам, но эта меня удивила. При скромных габаритах (меньше стакана) чистый, сочный звук с претензией на наличие басов (не сабвуфер конечно, но низкие частоты очень даже есть). На максимальной громкости никаких хрипов и дребезга - всё так же чисто и басисто. Рекомендую к покупке.;2
3 года назад это был просто огонь-телефон: большой угол обзора, мощный процессор и стильный дизайн. Прошло время, и зарядка не держится больше дня. динамик хрипит, приложения тормозят. Но все равно это мой верный помощник, с которым мы так много прошли!;3
Приобрел сиё устройство , покупкой полностью доволен.;1
Рекомендую,тем , кто по достоинству оценил портативную колонку типа Charge.;2
"Очень доволен телефоном, все нравится)))
Пользуюсь аккуратно после падения нексус 4)))";3
Удобный в ежедневном использовании пылесос, достойный внешний вид. Значительно сокращает время уборки, благодаря своей автономностью. Не приходиться постоянно переключать вилку из одной розетки в другую, и спотыкаться о провод. Тихий. При работе на первой скорости спокойно можно разговаривать, и её достаточно для сбора пыли, песка и волос с гладкого пола (плитка, паркет, линолеум);1
чтобы использовать карту на 64 gb надо отформатировать ее в fat 32;2
Самое большое разочарование вызвала камера и качество ее снимков, нестабильность фокусировки, не понятно на что она вобще фокусируется и отсутствие ручной настройки фокуса. Заряда хватает на долго с учетом постоянной передачи данных, включенной функцией места положения и активной работой пяти приложений - 10 - 11часов.;1
Покупал как полезный подарок для родителей. Специально с пультом, чтобы лишний раз не бегали. Пульт удобный, большой, не теряется. Мама говорит, что отец храпеть перестал. Очень доволен, подарок делал не зря.;1
катаемся уже 4 месяца... нам 1,3 годика... все нравится... папе удобно снимать одевать, маме тоже удобно, ребенок сладко спит, что еще надо? Помещается легко в багажник 5-ки бмв, еще остается кучу места в багажнике! Очень приятно тактильно и визуально;3
За такие деньги лучше пропустить эту модель, и взять нормальные уши.;1
Шикарная вещь для дома и поездок по городу. Памяти в идеале все-таки 32, потому для 16 ГБ версии ставлю 4-ку. Отсутсвие симки особо не мешает, сейчас много где есть вайфай а карту посмотреть можно и в телефоне.;1
