"Поначалу он вызывал у меня сомнения. Пересел на него с найнера Cube Analog и поначалу не понравилось и были сомнения в жесткости фиксации рамы. Но покатался по городу пару месяцев, съездил в поход в Приполярье и оценил его возможности. Легок, компактен (на большие расстояния иногда ездил с ним в машинах и маршрутках), красив. Аналоги стоят в 2-3 раза дороже, американский паратрупер - в 5-10 раз.  
За эти деньги отличный вел. Как и оригинал - Montague paratrooper, не предназначен для экстремальных упражнений, вроде прыжков (на нём) с двухметровой высоты или установления скоростных рекордов. Но если вам нужен СКЛАДНОЙ велосипед для городских трасс и для бездорожья, это очень хороший вариант.";1
Машинка оказалась действительно отличная за свою цену, справляется со своими функциями на все 100%, зав ремя пользования нареканий никаких не возникло.  Машинка сравнительно небольшая и поэтому ее удобно хранить, что является большим плюсом для небольшой квартиры. Для пользования в домашних условиях просто отличный вариант. Рекомендую всем.;1
Мне бы хотелось шарообразную клавиатуру или хотя бы кубическую. В первую очередь по причинам эргономики, говорю, как пользователь планшета. В общем, надеюсь, разработчики учтут мои пожелания и сделают более качественный продукт, отвечающий потребностям рынка. А пока только 4/5.;5
Вот смотрю я на остальные отзывы и диву даюсь... Друзья, а что же вы хотели от этой мыши? Цена-качество отличное, вот прицепились к покрытию кнопок прокликов. Как будто она сильно сильно пачкается. Я бы так не сказал. Это совершенно не мешает. Просто ухаживайте правильно за мышкой и все будет хорошо. А сам я мышкой очень доволен, по сравнению со своими родственниками-x7 - она лучшая по цене-качеству.;2
У меня в семье таких двое. Планшеты на Андроиде и iOS в сравнении с ним просто баловство. А уж цена (брал по 18 000) делает это приобретение ну просто великолепным. Пока не купил - представить себе не мог, какая няшечка.;3
Шикарные наушники! 2 года проработали отлично и сломался микрофон. Скорее всего что то перегнулось, из за вытаскивания постоянного. Но звук шикарный, красивые, берите не пожалеете!;3
Покупали всей семьей для общего пользования и для ребенка двух лет...Ох сколько же он испытаний перенес...По нем и прыгали и бросали и били рукой)))Хорошо держался,долго терпел весь этот ужас,но нечаянно уронили на кафель боком и все,стекло треснуло.Хочу сказать планшет мне понравился,сама лично смотрела видео и сидела в интернете,в принципе для чего и брали.Камера ну наверно средняя,мне не очень понравилась,фронтальная вообще плохая(Но думаю и этого хватает для этого планшета.Сразу хочу отметить,задняя крышка с самого начала неприятно хлюпала и трещала(Будто сейчас все развалиться,но нет!Как писала выше долго он терпел издевательств,но при этом работал хорошо!;3
Очень многофункциональное устройство. Будильник, календарь, фоторамка, видеоплеер и т.д. При этом сделан на совесть, без лагов, люфтов и т.п. Отличная модель!;1
"Искал гарнитуру которая звучит мягко и неназойливо.
Rapoo не из таких. Но качество звука очень приличное.
Звук четкий и АЧХ прятная уху. 
Удивило, что никто не упомянул о том, что наушники ощутимо давят на уши.
Конечно, не так, как изуверские ТА 56М, но не на секунду не дают забыть о том, что надета гарнитура.";1
Цена завышена в три раза, минимум. Надежность за такую цену посредственная. Стильная вещь, не больше.;1
обалденные часы очень стильно смотрятся.;3
пользовалась им порядка трех лет, под конец дул плохо и при переворотах менял силу выдува, умер - прям искры из него полетели. в общем средняя модель, на проф не тянет.;1
Очень приятные впечатления. Покупкой доволен. Рекомендую. Качество сборки отличное. Звук прекрасный.;3
"Покупали комплект из 2х трубок, 1 зарядки и 1 базы.
Спустя 5-6 лет эксплуатации 1 трубка сломалась. Просто не включается, в чем проблема не знаю.";1
Еслиб не колесо, был бы идеал, а так, если активно играешь, каждый год выкидывать под 3кр?;1
В целом телефоном доволен, советую к покупке.;1
Определенно это лучшая мультиварка из всех что  у меня были и есть. И не потому что новая модель и в ней много программ, а потому что готовит она вкуснее других. Да и в управлении все понятно куда и что жать, даже инструкция написана простым и доступным языком.;3
Реально хорошо работающее шумоподавление, в транспорте выручает и не только, еще дома, чтобы не слышать ни кого, а сосредоточиться. Сравнивал цены, эта модель действительно является одной из дешевых в этом классе, не смотря, что это дорогой бренд. Гарнитурка делает наушники универсальными. Приятно порадовал удобный футляр. Я пока доволен.;1
Аппарат скорее для средних офисов человек на 50. В типографии он не приживется, т.к. модели других брендов печатают гораздо лучше и не мнут листы.;1
Третий месяц как установили, хотя купили раньше, все руки никак не доходили. По сборке все было просто и легко, сам установил. Подключение тоже не составило труда, сразу сделал настройки. И сейчас почти не трогаю пульт. Доволен качеством. Не скрипит, и не шумит громко. Отличная модель.;1
Пользуюсь планшетом уже месяц впечатления только положительные!!! Очень удобен в учёбе и работе.Переходил с 'Android' поначалу все было непривычно и неудобно но уже на следующий вечер я уже знал все жесты и фишки) по мне он лучше iPad и Android.Всем советую брать!!!;3
пользовался несколько месяцев, ужасное впечатление, выбросил планшет так как ужасно тупит, даже оставив только нужные приложения, жалею что купил;3
Создает впечатление очень бюджетного тв;6
Звук хорош. Басы на уровне, слушать можно. Дизайн самих наушников крупноват. Оболочка штекера приклеена слабо, может пожалели клея? Пришлось подклеивать самому.;1
"Мышь прекрасно отработала полгода, не считая изредка возникающих проблем с боковой кнопкой, но дальше ей стало невозможно пользоваться. К счастью мышь окончательно вышла из строя за месяц до окончания гарантийного срока, поэтому удалось вернуть деньги.
Заранее знал, что у этих у данных ""грызунов"" бывают проблемы с сенсором, но надеялся что брак меня обойдёт стороной. Жаль, мышь мне очень нравилась.";1
Хотелось полноценный, но небольшой радиоприемник, так как  слушать радио по айподу без помех не представлялось возможность. Пролистывал сайт своего интернет-магазина, и наткнулся на этот приемник. Скинул почти полцены и купил. Приобретением очень доволен.;1
Купил неделю назад, телефоном полностью доволен;1
Вещь! Советую ! Замечательный звук на звуковушке Creative sound blaster 5.1 (внешняя), правда после замены провода ...;3
Советую приобрести этот комплект кто до сих пор не определился с выбором!!!!;2
Моя сестра всегда старалась выпрямить волосы - они у нее вьются, а я наоборот - накрутить, т.к. у меня прямые. И вот нашла для себя очень хорошого помощника в этом деле. Сделан крепко и качественно, не тяжелый и удобно держать в руке. Нагревается быстро, причем никакого запаха не было даже при первой завивке. Ну а смотреть как он затягивает, даже я бы сказала засасывает прядь, а потом из него выскакивает кудряшка - это просто завораживающее зрелище. Кудри получаются крепкие, выглядят естественно, волосы не сжигает и не электризует. В общем, я очень рада, что нашла для себя этот стайлер.;3
"Была куплена несколько лет назад,взамен родительской модели (без аккумулятора).Бреет хорошо.Аккумулятор - удобная вещь.Беру на работу,если некогда бриться дома.По моему опыту эксплуатации бритв Braun серии 1 могу рекомендовать положительными словами ""дешево и сердито"".Прослужит долго.";3
Покупал за 11990. Своих денег стоит. С WiFi дешевле сложно найти.;1
все замечательно, для меня ios это очень простая и понятная система, в ней нет ничего лишнего, как это обычно в андройде. Летает по сравнению с любым андройдом, никаких глюков, все сделанно качественно и хорошо. Как писали что через айтюнс проблемно сузыку кидать, я опровергну, это такой бред честно :) скачал айтюнс и скачал треки, все еще легче чем на андройд :) просто отличная модель) советую, тем более за такую цену :);3
Вот не знала моя мама куда выбросить деньги! Воет как самолет, практически ничего не сосоет, с пола может какой мусор и подбирает-чего-то в мусоросборник попадает, но с ковра..... постоянно нагибаешься чтоб собрать руками мусоринку.  В трубку мусор с руки не засасывается-иду в мусорку выбрасывать.Волосы с ковра не подбирает ваще. Щетка и трубка сплошное недоразумение-все хлипкое и шаткое. впрочем как и сам пылесос. Честно удивлена хвалебным отзывам.. заказные они что ли? После месяца мучений выкидываю его с чувством  полного облегчения-нервы знаете ли дороже.;3
Пользуюсь этим ноутбуком полтора год. Очень порадовало наличие полноценной клавиатуры и наличие сканера отпечатков пальцев, что позволило мне не заморачиваться с логинами и паролями от разных сайтов. Но отсутсвие возможности поиграть в некоторые игры из-за перегревов и несовместимости с 8 win портит о нём впечатление.;1
С такой камерой наверное даже фильмы снимать можно) Ну мы с женой и снимаем... не, вы не подумайте, разные там поездки, экскурсии) Мне по роду профессии часто путешествовать приходится, а жена со мной, обидно будет если все потом забудется, а так всегда под рукой будут видео с морем эмоций и впечатлений);3
Господа из Electrolux, как может за 1 год сдохнуть литиевый аккумулятор? Что теперь пылесос на свалку?;4
Советую брать эти наушники как хорошую гарнитуру (для iOS, под Android не работает). Однако, если вы хотите хорошего звука, то это не лучший вариант.;2
Отличный телефон за эти деньги, удобно лежит в руке, не большой но и не маленький, Не нравится только то что греется на играх и никакой звук при прослушивании музыки;1
Телефон подойдет как и мужчинам так и девушкам. Для девушек в селфи камере есть плюшки типо макияжа и ретуши лица.;1
а так за 4-5 месяцев использования нареканий нет. почти каждый день пользуюсь. чаще всего рис/крупы, плов, каши, суп, жарка. выпечку не готовила. мультиварка для ленивых.;1
Очень экономичная по сравнению с другими производителями. Мало потребляет воду, электроэнергию при режиме хлопок 40 гр. Есть автовзвешивание белья, быстрая стирка 15 минут и много других нужных программ. Отстирывает вещи хорошо. Довольна покупкой.;1
Хорошие материалы корпуса, пластик тщательно подогнан.;1
Рекомендую тем ,кто много работает с текстами.Сьемная клавиатура упрощает работу.Ну и 3G модификация позволяет ловить интернет в любом месте.;2
"Прекрасный телефон, покупал в подарок. Включил, подцепил к Wi-fi, сразу автоматически скачалось и установились два обновления Android. Включил службы геолокации, показывает время, погоду, местоположение. За те несколько часов, пока с ним игрался, успел его искренне полюбить. 
Не ожидал, что телефон за 8 т.р. окажется настолько быстрее и удобнее моего старичка iPhone 4s.
Рекомендую к покупке и пусть цена вас не смущает.";1
Брал на замену роутеру доставшегося от провайдера, доволен как слон;1
"Завидую я у кого газовые плиты (у нас нету газа в квартире) и стоят плиты с ""блинами"" (которые значительно дешевле). Причина в том, что когда ставишь нагревать воду, она долго закипает, т.к. срабатывает терморегулятор (температура дна кастрюли и поверхности круга выравниваются) и отключает нагрев спирали. Короче это так бесит! Ещё она сама отключается после полутора часов работы, некоторое мясо дольше варишь. Плюс приходится её постоянно до блеска натирать, т.к. будет прогорать стекло. До этого не было опыта использования варочной поверхности. Купили т.к. решили сделать красиво со встройкой в столешницу на кухне. Используем варочную поверхность уже год, всё работает. Так что эта красота, не добавила удобства. Да и посуду надо дорогую покупать, пришлось распрощаться с предыдущей. И что самое странное, так это запах горелой проводки при первых месяцах эксплуатации! Понятно что там подгорает изоляция. Я не подумал об этом и здорово понервничал, пришлось отдирать её от стола (а там уже всё было промазано герметиком), горелых проводов не обнаружил. Так что если чувствуете вонь, а дыма нету, то это ""нормально"" при начале использования (потом запах уйдёт). Вилки нету!!! Если Вы не электрик, то прийдется вызывать на монтаж.";3
Ближайшие конкуренты к этому Звуку начинаются от 50.000р. Видимо B&O позиционирует ушки к мобильному телефону, так как продает их через офиц.дилеров Apple. Но на самом деле, это почти HiEnd звук и предназначены ушки для самых требовательных аудиофилов! За ЭТОТ звук я готов все простить B&O. Берите не пожалеете! Слушаю на iBasso dx90 и Note4. Все предыдущие уши раздарил))) Так вот влюбился...;3
Подключен к видеокарте через с-видео для просмотра фильмов с компьютера.;6
Купил этот парогенератор, решил обрадовать жену и облегчить ей процесс глажки. Подарком угодил, судя по ее реакции, теперь у меня все костюмы и сорочки отпарены. Постельное белье можно гладить, складывая в несколько слоев. Жена довольна, я всегда одет с иголочки, мне больше ничего и ненадо.;1
Хороший аппарат. Мне нравится, что это и блендер, и функции комбайна есть. Лезвия у терок острые, мелят все, что им не дашь. Отлично готовит и фарш, и томатную пасту. Наконец-то я могу измельчить лук, не прорыдав море слез. Причем все делается очень быстро.;1
машинкой очень доволен. Она просто находка!!! Жаль что к ней не продаются комплектующие!;3
после выключения плиты, где то через 3-5 минут остывания неожиданно лопнул кружок при том, что плита бла совершенно чистая (не залита и тп.);1
Общее впечатление что техника надёжная!;3
Пользуюсь год кофеваркой,все устраивает. Удобство использования,быстрое приготовление кофе. Готовит с пенкой,перепробовали все сорта кофе.Купили по совету консультанта и остались довольны,свои функции кофеварка выполняет отлично. Всем советую;1
Дороговато, но покупка не на один день, качеством очень доволен и всем рекомендую!;3
Плата у меня 3 года, попала во время ремонта. Кто то не правильно подключил переднюю панель USB и выгорел предохранитель и все. Восстановил с тех пор у меня работает с процессорами то E6550 то E6750. Вот недавно достал Q6600 Поставил работает на 5;1
Хороший планшет , со своими задачами справляется хоть для работы тяжелых приложений нужен clean master . Немного расстроил тест Antutu показал 13500 очков без режима економии електроенергии и с помощью clean master , а так 9500 хоть читал что и так 13700.За такую цену отличный девайс советую для учебы , фильмов , серфинга и адекватных игр (по-моему Asphalt 8 без clean master это предел).;1
выбрал эту марку по совету товарища, нисколько не жалею. Если сегодня пришлось бы снова покупать, на другие бы и не смотрел, так как качеством звука доволен полностью.;1
